Genre,Ranks,Product,Author,Links,Price,Rating,Reviews
All,1,The Psychology of Money,Morgan Housel,https://amazon.in/Psychology-Money-Morgan-Housel/dp/9390166268/ref=zg_bs_books_1/259-4875650-4938338?pd_rd_i=9390166268&psc=1,285.00,4.6,"31,568"
All,2,Atomic Habits: The life-changing million copy bestseller,James Clear,https://amazon.in/Atomic-Habits-James-Clear/dp/1847941834/ref=zg_bs_books_2/259-4875650-4938338?pd_rd_i=1847941834&psc=1,520.00,4.6,"38,604"
All,3,Word Power Made Easy,Norman Lewis,https://amazon.in/Word-Power-Made-Norman-Lewis/dp/0143424688/ref=zg_bs_books_3/259-4875650-4938338?pd_rd_i=0143424688&psc=1,98.00,4.4,"37,007"
All,4,Oswaal CBSE Term 2 English Science Social Science & Math Standard Class 10 Sample Question Paper (Set of 4 Books) (For Term-2 2022 Exam) Free Access Code For Oswaal 360,Oswaal Editorial Board,https://amazon.in/Oswaal-English-Science-Standard-Question/dp/9354639941/ref=zg_bs_books_4/259-4875650-4938338?pd_rd_i=9354639941&psc=1,398.00,4.6,NA
All,5,"Grandma's Bag of Stories: Collection of 20+ Illustrated short stories, traditional Indian folk tales for all ages for children of all ages by Sudha Murty",Sudha Murty,https://amazon.in/Grandmas-Bag-Stories-Sudha-Murty/dp/0143333623/ref=zg_bs_books_5/259-4875650-4938338?pd_rd_i=0143333623&psc=1,155.00,4.6,NA
All,6,Rich Dad Poor Dad: What the Rich Teach Their Kids About Money That the Poor and Middle Class Do Not!,Robert T. Kiyosaki,https://amazon.in/Rich-Dad-Poor-Middle-Updates/dp/1612680194/ref=zg_bs_books_6/259-4875650-4938338?pd_rd_i=1612680194&psc=1,302.00,4.6,"57,471"
All,7,Ikigai: The Japanese secret to a long and happy life,Héctor García,https://amazon.in/Ikigai-H%C3%A9ctor-Garc%C3%ADa/dp/178633089X/ref=zg_bs_books_7/259-4875650-4938338?pd_rd_i=178633089X&psc=1,401.00,4.6,"31,295"
All,8,My First Library: Boxset of 10 Board Books for Kids,Wonder House Books,https://amazon.in/My-First-Library-Boxset-Board/dp/9387779262/ref=zg_bs_books_8/259-4875650-4938338?pd_rd_i=9387779262&psc=1,606.00,4.5,"48,781"
All,9,27 Years UPSC IAS/ IPS Prelims Topic-wise Solved Papers 1 & 2 (1995 - 2021) 12th Edition,Mrunal Patel,https://amazon.in/Years-Prelims-Topic-wise-Solved-Papers/dp/9355640005/ref=zg_bs_books_9/259-4875650-4938338?pd_rd_i=9355640005&psc=1,335.00,4.5,NA
All,10,"My First Mythology Tale (Illustrated) (Set of 5 Books) - Mahabharata, Krishna, Hanuman, Ganesha, Ramayana - Story Book for Kids",Maple Press,https://amazon.in/First-Mythology-Tale-Illustrated-Books/dp/9390292964/ref=zg_bs_books_10/259-4875650-4938338?pd_rd_i=9390292964&psc=1,189.00,4.4,"3,828"
All,11,Quantitative Aptitude for Competitive Examinations,R S Aggarwal,https://amazon.in/Quantitative-Aptitude-Competitive-Examinations-Aggarwal/dp/9352534026/ref=zg_bs_books_11/259-4875650-4938338?pd_rd_i=9352534026&psc=1,465.00,4.4,"24,682"
All,12,Man's Search For Meaning: The classic tribute to hope from the Holocaust,Viktor E Frankl,https://amazon.in/Mans-Search-Meaning-Viktor-Frankl/dp/1846041244/ref=zg_bs_books_12/259-4875650-4938338?pd_rd_i=1846041244&psc=1,175.00,4.5,"40,265"
All,13,Mathematics for Class 10 - CBSE - by R.D. Sharma Examination 2022-23,R.D. Sharma,https://amazon.in/Mathematics-Class-10-Examination-2022-23/dp/B09SJ365JL/ref=zg_bs_books_13/259-4875650-4938338?pd_rd_i=B09SJ365JL&psc=1,535.00,4.3,110
All,14,DO EPIC SHIT,Ankur Warikoo,https://amazon.in/DO-EPIC-SHIT-Ankur-Warikoo/dp/9391165486/ref=zg_bs_books_14/259-4875650-4938338?pd_rd_i=9391165486&psc=1,297.00,4.5,"3,729"
All,15,"India that is Bharat: Coloniality, Civilisation, Constitution",J Sai Deepak,https://amazon.in/India-that-Bharat-Civilisation-Constitution/dp/9354352499/ref=zg_bs_books_15/259-4875650-4938338?pd_rd_i=9354352499&psc=1,499.00,4.8,"3,190"
All,16,Oswaal CBSE Term 2 Science Class 10 Sample Question Paper Book (For Term-2 2022 Exam),Oswaal Editorial Board,https://amazon.in/Oswaal-Science-Sample-Question-Term-2/dp/935463897X/ref=zg_bs_books_16/259-4875650-4938338?pd_rd_i=935463897X&psc=1,139.00,4.5,85
All,17,"MTG Objective NCERT at your FINGERTIPS - Biology, Best NEET Books (Based on NCERT Pattern - Latest & Revised Edition 2022)",MTG Editorial Board,https://amazon.in/MTG-Objective-NCERT-your-FINGERTIPS/dp/9391191789/ref=zg_bs_books_17/259-4875650-4938338?pd_rd_i=9391191789&psc=1,573.00,4.6,NA
All,18,The Power of Your Subconscious Mind,Joseph Murphy,https://amazon.in/Power-Your-Subconscious-Mind/dp/8194790832/ref=zg_bs_books_18/259-4875650-4938338?pd_rd_i=8194790832&psc=1,125.00,4.5,"51,460"
All,19,It Ends With Us: A Novel: Volume 1,Colleen Hoover,https://amazon.in/Ends-Us-Novel-Colleen-Hoover/dp/1501110365/ref=zg_bs_books_19/259-4875650-4938338?pd_rd_i=1501110365&psc=1,159.00,4.6,"54,209"
All,20,"Educart Term 2 Class 10 Sample Papers Bundle of Science, Math Standard, Social Science & English Books For 2022 (Based on the CBSE Term-2 Subjective Sample Paper released on 14 Jan 2022) Edubook",Sanjiv Sir,https://amazon.in/Educart-Science-Standard-Subjective-released/dp/B09R1TPZW2/ref=zg_bs_books_20/259-4875650-4938338?pd_rd_i=B09R1TPZW2&psc=1,425.00,4.4,NA
All,21,Pankaj Ladha & Anant Ladha,Pankaj Ladha & Anant Ladha,https://amazon.in/Swing-Trading-Strategies-Pankaj-Invest/dp/9390542588/ref=zg_bs_books_21/259-4875650-4938338?pd_rd_i=9390542588&psc=1,299.00,NA,NA
All,22,CBSE All In One Social Science Class 10 2022-23 Edition,Madhumita Pattrea,https://amazon.in/CBSE-Social-Science-Class-2022-23/dp/9326193268/ref=zg_bs_books_22/259-4875650-4938338?pd_rd_i=9326193268&psc=1,494.00,4.6,NA
All,23,"Combo Pack: Lakhmir Singh Class 10 Science (Biology, Physics, Chemistry) - Examination 2022-23",Manjit Kaur; Lakhmir Singh,https://amazon.in/Combo-Pack-Lakhmir-Chemistry-Examination/dp/B09PKHZZMB/ref=zg_bs_books_23/259-4875650-4938338?pd_rd_i=B09PKHZZMB&psc=1,"1,309.00",4.4,NA
All,24,Mathematics for Class 9 - CBSE - by R.D. Sharma Examination 2022-23,R.D. Sharma,https://amazon.in/Mathematics-Class-Sharma-Examination-2022-23/dp/B09SJ5TZZ4/ref=zg_bs_books_24/259-4875650-4938338?pd_rd_i=B09SJ5TZZ4&psc=1,490.00,4.5,30
All,25,Picture Books Collection for Early Learning (Set of 12),E C Axus,https://amazon.in/Picture-Books-Collection-Early-Learning/dp/B01M0QGF0P/ref=zg_bs_books_25/259-4875650-4938338?pd_rd_i=B01M0QGF0P&psc=1,250.00,4.3,NA
All,26,Attitude Is Everything: Change Your Attitude ... Change Your Life!,Jeff Keller,https://amazon.in/Attitude-Everything-Change-Your-Life/dp/9351772071/ref=zg_bs_books_26/259-4875650-4938338?pd_rd_i=9351772071&psc=1,147.00,4.5,"17,285"
All,27,The Almanack Of Naval Ravikant: A Guide to Wealth and Happiness,Eric Jorgenson,https://amazon.in/Almanack-Naval-Ravikant-Wealth-Happiness/dp/9354893899/ref=zg_bs_books_27/259-4875650-4938338?pd_rd_i=9354893899&psc=1,210.00,4.7,"4,803"
All,28,Spoken English Course (Telugu),Vashista 360,https://amazon.in/Spoken-English-Course-Telugu-Vashista/dp/B08W1SNNLP/ref=zg_bs_books_28/259-4875650-4938338?pd_rd_i=B08W1SNNLP&psc=1,284.00,4.2,Vashista 360
All,29,"Oswaal CBSE Question Bank Chapterwise For Term 2, Class 10, Science (For 2022 Exam)",Oswaal Editorial Board,https://amazon.in/Oswaal-Question-Chapterwise-Class-Science/dp/9354636586/ref=zg_bs_books_29/259-4875650-4938338?pd_rd_i=9354636586&psc=1,193.00,4.4,286
All,30,Brain Activity Book for Kids - 200+ Activities for Age 3+,Maple Press,https://amazon.in/Brain-Activity-Book-Kids-Activities/dp/9391924298/ref=zg_bs_books_30/259-4875650-4938338?pd_rd_i=9391924298&psc=1,94.00,4.5,NA
All,31,Best of Children’s Classics (Set of 5 Books): Perfect Gift Set for Kids,Antoine de Saint-Exupéry,https://amazon.in/Best-Childrens-Classics-Set-Books/dp/9389432006/ref=zg_bs_books_31/259-4875650-4938338?pd_rd_i=9389432006&psc=1,487.00,4.4,NA
All,32,CBSE All In One Science Class 10 for 2022-23 Edition,Sonal Singh,https://amazon.in/CBSE-All-Science-Class-2022-23/dp/932619325X/ref=zg_bs_books_32/259-4875650-4938338?pd_rd_i=932619325X&psc=1,575.00,4.8,NA
All,33,The Alchemist,Paulo Coelho,https://amazon.in/Alchemist-Paulo-Coelho/dp/8172234988/ref=zg_bs_books_33/259-4875650-4938338?pd_rd_i=8172234988&psc=1,250.00,4.6,"73,697"
All,34,CBSE All In One English Language & Literature Class 10 2022-23 Edition,Srishti Agarwal,https://amazon.in/English-Language-Literature-Class-2022-23/dp/B09RMZT7B8/ref=zg_bs_books_34/259-4875650-4938338?pd_rd_i=B09RMZT7B8&psc=1,467.00,4.4,NA
All,35,Moral Story Books for Kids (Pack of 10 Books) | 160 Total Pages | Illustrated Stories,Young Angels Publishing,https://amazon.in/Moral-Story-Books-Illustrated-Stories/dp/9381569886/ref=zg_bs_books_35/259-4875650-4938338?pd_rd_i=9381569886&psc=1,240.00,4.3,NA
All,36,T.S. Grewal's Double Entry Book Keeping: Accounting for Not-for-Profit Organizations and Partnership Firms -(Vol. 1) Textbook for CBSE Class 12 (2022-23 Session),T.S. Grewal,https://amazon.in/Grewals-Double-Entry-Keeping-Profit/dp/9390851556/ref=zg_bs_books_36/259-4875650-4938338?pd_rd_i=9390851556&psc=1,485.00,4.4,NA
All,37,My First Book of Pencil Control : Practice Pattern Writing (Full Color Pages): Patterns Practice book for kids (Pattern Writing),Wonder House Books,https://amazon.in/First-Book-Patterns-Pencil-Control/dp/9387779319/ref=zg_bs_books_37/259-4875650-4938338?pd_rd_i=9387779319&psc=1,140.00,4.4,NA
All,38,How to Win Friends and Influence People,Dale Carnegie,https://amazon.in/How-Win-Friends-Influence-People/dp/8129140179/ref=zg_bs_books_38/259-4875650-4938338?pd_rd_i=8129140179&psc=1,84.00,4.5,"64,743"
All,39,Rich Dad Poor Dad - 20Th Anniversary Edition - Hindi,Robert T. Kiyosaki,https://amazon.in/Rich-Dad-Poor-Robert-Kiyosaki/dp/8186775218/ref=zg_bs_books_39/259-4875650-4938338?pd_rd_i=8186775218&psc=1,231.00,4.5,"10,385"
All,40,101 Panchatantra Stories for Children: Colourful Illustrated Stories,Om Books Editorial Team,https://amazon.in/101-Panchatantra-Stories-Children-Illustrated/dp/935376517X/ref=zg_bs_books_40/259-4875650-4938338?pd_rd_i=935376517X&psc=1,162.00,4.5,NA
All,41,"MTG Objective NCERT at your FINGERTIPS - Chemistry, Best Books for NEET & JEE Preparation (Based on NCERT Pattern - Latest & Revised Edition 2022)",MTG Editorial Board,https://amazon.in/MTG-Objective-NCERT-your-FINGERTIPS/dp/939119172X/ref=zg_bs_books_41/259-4875650-4938338?pd_rd_i=939119172X&psc=1,495.00,4.5,NA
All,42,Indian Polity For Civil Services and Other State Examinations| 6th Revised Edition,M Laxmikanth,https://amazon.in/Indian-English-Revised-Services-Administrative/dp/9354600352/ref=zg_bs_books_42/259-4875650-4938338?pd_rd_i=9354600352&psc=1,649.00,4.4,"1,086"
All,43,Very First Sight Words Sentences Level 1,Dreamland Publications,https://amazon.in/First-Sight-Words-Sentences-Level/dp/9387971996/ref=zg_bs_books_43/259-4875650-4938338?pd_rd_i=9387971996&psc=1,175.00,4.5,"9,238"
All,44,"Karma: A Yogi's Guide to Crafting Your Destiny | Spirituality, Self-improvement & Self help books by Sadhguru | Penguin",Sadhguru,https://amazon.in/Karma-PUBLISHERS-BESTSELLER-spirituality-self-improvement/dp/0143452673/ref=zg_bs_books_44/259-4875650-4938338?pd_rd_i=0143452673&psc=1,160.00,4.7,"8,175"
All,45,Oswaal CBSE Term 2 Mathematics Standard Class 10 Sample Question Paper Book (For Term-2 2022 Exam),Oswaal Editorial Board,https://amazon.in/Oswaal-Mathematics-Standard-Sample-Question/dp/9354639135/ref=zg_bs_books_45/259-4875650-4938338?pd_rd_i=9354639135&psc=1,123.00,4.4,103
All,46,As a Man Thinketh,James Allen,https://amazon.in/As-Man-Thinketh-James-Allen/dp/9386538172/ref=zg_bs_books_46/259-4875650-4938338?pd_rd_i=9386538172&psc=1,69.00,4.4,"7,740"
All,47,Deep Work: Rules for Focused Success in a Distracted World,Cal Newport,https://amazon.in/Deep-Work-Focused-Success-Distracted/dp/0349413681/ref=zg_bs_books_47/259-4875650-4938338?pd_rd_i=0349413681&psc=1,281.00,4.5,"10,949"
All,48,"Oswal - Gurukul 36 Sample Question Papers Commerce CBSE Class 12 Term II Exam 2022 : Solved New SQP Pattern (Accountancy, Business Studies, Economics, Mathematics, English, Physical Education)",Oswal - Gurukul,https://amazon.in/Oswal-Accountancy-Economics-Mathematics-Education/dp/9392563663/ref=zg_bs_books_48/259-4875650-4938338?pd_rd_i=9392563663&psc=1,342.00,4.4,33
All,49,"Life's Amazing Secrets: How to Find Balance and Purpose in Your Life | Inspirational Zen book on motivation, self-development & healthy living",Gaur Gopal Das,https://amazon.in/Lifes-Amazing-Secrets-Balance-Purpose/dp/0143442295/ref=zg_bs_books_49/259-4875650-4938338?pd_rd_i=0143442295&psc=1,214.00,4.6,"14,983"
All,50,"The Courage To Be Disliked: How to free yourself, change your life and achieve real happiness (Courage To series)",Ichiro Kishimi and Fumitake Koga,https://amazon.in/Courage-Disliked-Ichiro-Kishimi-Fumitake/dp/1760630721/ref=zg_bs_books_50/259-4875650-4938338?pd_rd_i=1760630721&psc=1,353.00,4.5,NA
All,51,Introductory Macro Economics for Class 12 - CBSE - by Sandeep Garg Examination 2022-23,Sandeep Garg,https://amazon.in/Introductory-Macro-Economics-Class-Examination/dp/B09RV2Z55D/ref=zg_bs_books_1/259-2992512-9024531?pd_rd_i=B09RV2Z55D&psc=1,449.00,4.8,20
All,52,A Modern Approach To Verbal & Non-Verbal Reasoning (2 Colour Edition),R.S. Aggarwal,https://amazon.in/Modern-Approach-Verbal-Non-Verbal-Reasoning/dp/9352832167/ref=zg_bs_books_2/259-2992512-9024531?pd_rd_i=9352832167&psc=1,535.00,4.4,"11,186"
All,53,400 Days,Chetan Bhagat,https://amazon.in/400-Days-Chetan-Bhagat/dp/1542094089/ref=zg_bs_books_3/259-2992512-9024531?pd_rd_i=1542094089&psc=1,151.00,4.4,"7,888"
All,54,The Intelligent Investor (English) Paperback – 2013,Benjamin Graham,https://amazon.in/Intelligent-Investor-English-Paperback-2013/dp/0062312685/ref=zg_bs_books_4/259-2992512-9024531?pd_rd_i=0062312685&psc=1,480.00,4.5,"28,950"
All,55,The Monk Who Sold His Ferrari,Robin Sharma,https://amazon.in/Monk-Who-Sold-His-Ferrari/dp/817992162X/ref=zg_bs_books_5/259-2992512-9024531?pd_rd_i=817992162X&psc=1,154.00,4.5,"20,982"
All,56,Great Stories for Children,Ruskin Bond,https://amazon.in/Great-Stories-Children-Ruskin-Bond/dp/8129118920/ref=zg_bs_books_6/259-2992512-9024531?pd_rd_i=8129118920&psc=1,175.00,4.5,"9,223"
All,57,NCERT Textbooks in English for class 12 - Flamingo and Vistas - 12074 &12075,NCERT,https://amazon.in/NCERT-Textbooks-English-class-12/dp/B08K4JM83V/ref=zg_bs_books_7/259-2992512-9024531?pd_rd_i=B08K4JM83V&psc=1,102.00,4.4,NA
All,58,Oswaal Term 2 English Core CBSE Class 12 Sample Question Paper Book (For Term-2 2022 Exam) Oswaal Books,Oswaal Editorial Board,https://amazon.in/Oswaal-English-Sample-Question-Term-2/dp/9354639968/ref=zg_bs_books_8/259-2992512-9024531?pd_rd_i=9354639968&psc=1,111.00,4.6,49
All,59,Eat That Frog!: 21 Great Ways to Stop Procrastinating and Get More Done in Less Time,Brian Tracy,https://amazon.in/Eat-That-Frog-Great-Procrastinating/dp/152309513X/ref=zg_bs_books_9/259-2992512-9024531?pd_rd_i=152309513X&psc=1,166.00,4.6,"5,309"
All,60,World’s Greatest Books For Personal Growth & Wealth (Set of 4 Books): Perfect Motivational Gift Set,Dale Carnegie,https://amazon.in/Worlds-Greatest-Personal-Growth-Wealth/dp/9389432014/ref=zg_bs_books_10/259-2992512-9024531?pd_rd_i=9389432014&psc=1,499.00,4.5,NA
All,61,Oswaal CBSE Term 2 Hindi B Class 10 Sample Question Papers Book (For Term-2 2022 Exam),Oswaal Editorial Board,https://amazon.in/Oswaal-Sample-Question-Papers-Term-2/dp/9354638902/ref=zg_bs_books_11/259-2992512-9024531?pd_rd_i=9354638902&psc=1,132.00,4.3,31
All,62,Computer Science With Python Textbook And Practical Book For Class 12 (Examination 2020-2021),Sumita Arora,https://amazon.in/Computer-Science-Python-2019-2020-Examination/dp/8177002368/ref=zg_bs_books_12/259-2992512-9024531?pd_rd_i=8177002368&psc=1,595.00,4.5,"1,904"
All,63,"Brain Games for Clever Kids: Puzzles to Exercise Your Mind (Buster Brain Games, 1)",Gareth Moore,https://amazon.in/Brain-Games-Clever-Kids-Buster/dp/1780552491/ref=zg_bs_books_13/259-2992512-9024531?pd_rd_i=1780552491&psc=1,183.00,4.3,NA
All,64,CBSE All In One English Core Class 12 2022-23 Edition,Nandini Sharma Srishti Agarwal,https://amazon.in/CBSE-English-Core-Class-2022-23/dp/9326193101/ref=zg_bs_books_14/259-2992512-9024531?pd_rd_i=9326193101&psc=1,494.00,4.1,NA
All,65,Story books- Moral Stories for Children -Set of 10 Illustrated Books (Packed in a Gift Box),Om Books Editorial Team,https://amazon.in/books-Stories-Children-Illustrated-Packed/dp/9391258492/ref=zg_bs_books_15/259-2992512-9024531?pd_rd_i=9391258492&psc=1,225.00,4.3,NA
All,66,Wren & Martin High School English Grammar And Composition Book (Regular Edition),"Rao N,D,V,Prasada",https://amazon.in/School-English-Grammar-Composition-Regular/dp/9352530144/ref=zg_bs_books_16/259-2992512-9024531?pd_rd_i=9352530144&psc=1,360.00,4.5,"8,658"
All,67,Benimadhav Shiler Ful Panjika 1429 || English 2022-2023,Benimadhav Shil,https://amazon.in/Benimadhav-Shiler-Panjika-English-2022-2023/dp/B09MWJJSJN/ref=zg_bs_books_17/259-2992512-9024531?pd_rd_i=B09MWJJSJN&psc=1,80.00,4.7,NA
All,68,The Blue Umbrella,Ruskin Bond,https://amazon.in/Blue-Umbrella-Ruskin-Bond/dp/8171673406/ref=zg_bs_books_18/259-2992512-9024531?pd_rd_i=8171673406&psc=1,95.00,4.5,"10,906"
All,69,How to Talk to Anyone: 92 Little Tricks for Big Success in Relationships,Leil Lowndes,https://amazon.in/How-Talk-Anyone-Success-Relationships/dp/0007272618/ref=zg_bs_books_19/259-2992512-9024531?pd_rd_i=0007272618&psc=1,231.00,4.4,"5,331"
All,70,Complete Guide To NDA Maths,Arpit Choudhary,https://amazon.in/Complete-Guide-Maths-Arpit-Choudhary/dp/B09XN7B51Y/ref=zg_bs_books_20/259-2992512-9024531?pd_rd_i=B09XN7B51Y&psc=1,999.00,5.0,NA
All,71,Oswaal Term 2 Mathematics CBSE Class 12 Sample Question Paper Book (For Term-2 2022 Exam) Oswaal Books,Oswaal Editorial Board,https://amazon.in/Oswaal-Mathematics-Sample-Question-Term-2/dp/935463818X/ref=zg_bs_books_21/259-2992512-9024531?pd_rd_i=935463818X&psc=1,130.00,4.6,40
All,72,"Tiger of Drass: Capt. Anuj Nayyar, 23, Kargil Hero",Meena Nayyar,https://amazon.in/Tiger-Drass-Capt-Nayyar-Kargil/dp/9354229263/ref=zg_bs_books_22/259-2992512-9024531?pd_rd_i=9354229263&psc=1,250.00,4.9,62
All,73,Secondary School Mathematics for Class 10 (Examination 2020-2021),R.S. Aggarwal,https://amazon.in/Secondary-School-Mathematics-Examination-2020-2021/dp/9388704517/ref=zg_bs_books_23/259-2992512-9024531?pd_rd_i=9388704517&psc=1,530.00,4.5,872
All,74,Brijbhoomi Books And Handicrafts® Bhagavad Gita: Yatharoop,Brijbhoomi Books And Handicrafts,https://amazon.in/Bhagavad-Gita-Bhaktivendanta-Swami-Prabhupada/dp/938598618X/ref=zg_bs_books_24/259-2992512-9024531?pd_rd_i=938598618X&psc=1,224.00,4.8,NA
All,75,101 Brain Booster Activity Book: Fun Activity Book For Children,Wonder House Books,https://amazon.in/101-Brain-Booster-Activity-Book/dp/9388369793/ref=zg_bs_books_25/259-2992512-9024531?pd_rd_i=9388369793&psc=1,139.00,4.4,"4,063"
All,76,Treasure Island,Robert Louis Stevenson,https://amazon.in/Treasure-Island-Robert-Louis-Stevenson/dp/8172344767/ref=zg_bs_books_26/259-2992512-9024531?pd_rd_i=8172344767&psc=1,99.00,4.3,"8,623"
All,77,Concept of Physics Part-2 (2019-2020 Session) by H.C Verma,H.C. Verma,https://amazon.in/Concept-Physics-Part-2-2018-2019-Session/dp/8177092324/ref=zg_bs_books_27/259-2992512-9024531?pd_rd_i=8177092324&psc=1,439.00,4.6,"8,074"
All,78,Arihant CBSE Term 2 Science Class 10 Sample Question Papers (As per CBSE Term 2 Sample Paper Issued on 14 Jan 2022),Manish Dangwal,https://amazon.in/Arihant-Science-Sample-Question-Papers/dp/9325798980/ref=zg_bs_books_28/259-2992512-9024531?pd_rd_i=9325798980&psc=1,108.00,4.3,16
All,79,Coffee Can Investing: The Low Risk Road to Stupendous Wealth,Saurabh Mukherjea,https://amazon.in/Coffee-Can-Investing-Stupendous-Wealth/dp/067009045X/ref=zg_bs_books_29/259-2992512-9024531?pd_rd_i=067009045X&psc=1,368.00,4.5,"3,045"
All,80,"Oxford Student Atlas for India, Fourth Edition - Useful for Competitive Exams",Oxford University Press,https://amazon.in/Oxford-Student-Atlas-India-Fourth/dp/9391050840/ref=zg_bs_books_30/259-2992512-9024531?pd_rd_i=9391050840&psc=1,225.00,4.2,NA
All,81,"Blossom Moral Story Book for Kids 1 Years to 10 Years Old in English | 31 Fairy Tale Stories with Colourful Pictures | Best Bedtime Children Story Book | Short Stories for Infants, Toddlers | Book A",Content Team at Target Publications,https://amazon.in/Blossom-English-Colourful-Pictures-Children/dp/B0845PS3QW/ref=zg_bs_books_81/259-2992512-9024531?pd_rd_i=B0845PS3QW&psc=1,80.00,4.4,NA
All,82,Secondary School Mathematics for Class 9 - CBSE - by R.S. Aggarwal Examination 2022-2023,R.S. Aggarwal,https://amazon.in/Secondary-School-Mathematics-Class-Examination/dp/9350271850/ref=zg_bs_books_82/259-2992512-9024531?pd_rd_i=9350271850&psc=1,455.00,4.5,"1,557"
All,83,Mathematics For Class 8 (Examination 2020-2021),R.D. Sharma,https://amazon.in/Mathematics-Class-Sharma-2018-19-Session/dp/818992804X/ref=zg_bs_books_83/259-2992512-9024531?pd_rd_i=818992804X&psc=1,425.00,4.6,"3,006"
All,84,Cellsius & NEET kaka JEE,Cellsius & NEET kaka JEE,https://amazon.in/Physics-Formula-Chart-Cellsius-NEET/dp/B09XRCMHY2/ref=zg_bs_books_84/259-2992512-9024531?pd_rd_i=B09XRCMHY2&psc=1,199.00,NA,NA
All,85,Manorama English Yearbook 2022,Mammen Mathew,https://amazon.in/Manorama-English-Yearbook-Mammen-Mathew/dp/8195407277/ref=zg_bs_books_85/259-2992512-9024531?pd_rd_i=8195407277&psc=1,276.00,4.6,514
All,86,Price Action Trading : Technical Analysis Simplified!,Sunil Gurjar (Chartmojo),https://amazon.in/Price-Action-Trading-Technical-Simplified/dp/8195261612/ref=zg_bs_books_86/259-2992512-9024531?pd_rd_i=8195261612&psc=1,310.00,4.3,NA
All,87,"Oswaal CBSE Question Bank Chapterwise For Term 2, Class 10, Mathematics (Standard) (For 2022 Exam)",Oswaal Editorial Board,https://amazon.in/Oswaal-Question-Chapterwise-Mathematics-Standard/dp/9354636675/ref=zg_bs_books_87/259-2992512-9024531?pd_rd_i=9354636675&psc=1,185.00,4.4,200
All,88,GIKSO 100 Maths Puzzles Book - Brain Boosting Mathematical Activities for Age 7+ Years Old Kids | Game Book (English) - Reprinted 2021,GIKSO,https://amazon.in/GIKSO-100-Maths-Puzzles-Book/dp/8193864999/ref=zg_bs_books_88/259-2992512-9024531?pd_rd_i=8193864999&psc=1,170.00,4.3,NA
All,89,108 Panchatantra Stories (Illustrated) for children,Maple Press,https://amazon.in/108-Panchatantra-Stories-Illustrated-children/dp/9390292921/ref=zg_bs_books_89/259-2992512-9024531?pd_rd_i=9390292921&psc=1,91.00,4.4,"1,292"
All,90,"Tuesdays With Morrie: An old man, a young man, and life's greatest lesson",Mitch Albom,https://amazon.in/Tuesdays-Morrie-young-greatest-lesson/dp/0751527378/ref=zg_bs_books_90/259-2992512-9024531?pd_rd_i=0751527378&psc=1,236.00,4.6,"13,770"
All,91,The Subtle Art of Not Giving a F*ck: A Counterintuitive Approach to Living a Good Life,Mark Manson,https://amazon.in/Subtle-Art-Not-Giving/dp/0062641549/ref=zg_bs_books_91/259-2992512-9024531?pd_rd_i=0062641549&psc=1,303.00,4.5,"60,942"
All,92,"MTG 34 Years NEET Previous Year Solved Question Papers with NEET Chapterwise Topicwise Solutions - NEET 2022 Preparation Books, Set of 3 Books NTA Neet 34 Years Questions, Physics Chemistry Biology",MTG Learning Media (P) Ltd.,https://amazon.in/Previous-Question-Chapterwise-Topicwise-Solutions/dp/B09HTLGSQF/ref=zg_bs_books_92/259-2992512-9024531?pd_rd_i=B09HTLGSQF&psc=1,664.00,4.3,NA
All,93,Oxford School Atlas: India's Most Trusted Atlas 36th edition,Oxford,https://amazon.in/Oxford-School-Atlas/dp/0190123656/ref=zg_bs_books_93/259-2992512-9024531?pd_rd_i=0190123656&psc=1,280.00,4.5,"2,379"
All,94,The Power of A Positive Attitude: Your Road To Success,Roger Fritz,https://amazon.in/Power-Positive-Attitude-Your-Success/dp/9389432642/ref=zg_bs_books_94/259-2992512-9024531?pd_rd_i=9389432642&psc=1,99.00,4.4,"1,735"
All,95,Arihant CBSE Term 2 Mathematics Standard Class 10 Sample Question Papers (As per CBSE Term 2 Sample Paper Issued on 14 Jan 2022),Hanuman Parik,https://amazon.in/Arihant-Mathematics-Standard-Sample-Question/dp/9325798964/ref=zg_bs_books_95/259-2992512-9024531?pd_rd_i=9325798964&psc=1,120.00,4.3,14
All,96,Oswaal CBSE Term 2 English Language & Literature Class 10 Sample Question Paper Book (For Term-2 2022 Exam),Oswaal Editorial Board,https://amazon.in/Oswaal-English-Language-Literature-Question/dp/9354638937/ref=zg_bs_books_96/259-2992512-9024531?pd_rd_i=9354638937&psc=1,122.00,4.5,61
All,97,Oxford English Mini Dictionary - Indian Edition,Dictionaries,https://amazon.in/Oxford-English-Mini-Dictionary-Indian/dp/0198075553/ref=zg_bs_books_97/259-2992512-9024531?pd_rd_i=0198075553&psc=1,185.00,4.4,NA
All,98,The Diary of a Young Girl,Anne Frank,https://amazon.in/Diary-Young-Girl-Anne-Frank/dp/8172345194/ref=zg_bs_books_98/259-2992512-9024531?pd_rd_i=8172345194&psc=1,163.00,4.6,"16,579"
All,99,Grandparents' Bag of Stories,Sudha Murty,https://amazon.in/Grandparents-Bag-Stories-Sudha-Murty/dp/0143451847/ref=zg_bs_books_99/259-2992512-9024531?pd_rd_i=0143451847&psc=1,197.00,4.7,NA
All,100,1984,George Orwell,https://amazon.in/1984-George-Orwell/dp/9389053730/ref=zg_bs_books_100/259-2992512-9024531?pd_rd_i=9389053730&psc=1,79.00,4.5,"61,315"
Action & Adventure,1,Harry Potter and the Philosopher's Stone,J.K. Rowling,https://amazon.in/Harry-Potter-Philosophers-Stone-Rowling-ebook/dp/B019PIOJYU/ref=zg_bs_1318158031_1/258-1111006-1231057?pd_rd_i=B019PIOJYU&psc=1,285.95,4.7,"38,250"
Action & Adventure,2,The Complete Novels of Sherlock Holmes,Arthur Conan Doyle,https://amazon.in/Complete-Novels-Sherlock-Holmes/dp/8175994312/ref=zg_bs_1318158031_2/258-1111006-1231057?pd_rd_i=8175994312&psc=1,165.00,4.5,"12,832"
Action & Adventure,3,"The Silent Patient: The record-breaking, multimillion copy Sunday Times bestselling thriller and Richard & Judy book club pick",Alex Michaelides,https://amazon.in/Silent-Patient-Alex-Michaelides/dp/1409181634/ref=zg_bs_1318158031_3/258-1111006-1231057?pd_rd_i=1409181634&psc=1,324.00,4.5,"90,195"
